{
  "schema_version": "1.1.0",
  "registry": "datasets",
  "updated": "2026-09-30",
  "notice": "Dataset and source registry for the EMXplore Radio Astronomy project. Sources with visibility 'private' are research files that are not distributed. They are referenced only by opaque logical IDs; storage locations and checksums are kept in a private local-source manifest outside this public registry. Private project records are never quoted; they may only support neutral 'inferred' notes. Historical products keep their original calibration epoch (see calibration-epochs.json).",
  "data_levels": {
    "L0": "Native spectral acquisition: averaged power spectra as written by the acquisition software (NOT raw I/Q), or the same values resampled to a common grid (product_class resampled_spectra).",
    "L1": "Observation organisation: scan manifests, pointing tracks, session metadata.",
    "L2": "Reduced spectra: baseline/bandpass removed, quality-gated, still on a relative scale.",
    "L3": "Calibrated spectra: values on a temperature scale of a named calibration epoch.",
    "L4": "Spectral cubes: gridded position-position-velocity data.",
    "L5": "Derived science products: peak/velocity/moment maps, catalogues, velocity tables, fitted calibration constants.",
    "L6": "Curated / corrected products: selection rules, stray-radiation or other corrections, multi-session composites.",
    "L7": "Visualization: figures and renderings made from lower levels.",
    "L8": "Independently reproduced publication products: regenerated from L0/L1 by documented code with a recorded lineage."
  },
  "sources": [
    {
      "source_id": "src-cal-report-20260923",
      "kind": "research_file",
      "title": "DISH222 absolute brightness-temperature calibration report (23 Sep 2026)",
      "visibility": "private"
    },
    {
      "source_id": "src-yfactor-record-20260902",
      "kind": "research_file",
      "title": "Y-factor calibration record written by the acquisition software (2 Sep 2026)",
      "visibility": "private"
    },
    {
      "source_id": "src-kelvin-map-figure-20260901",
      "kind": "research_file",
      "title": "First kelvin-calibrated map of the 1 Sep 2026 scan (figure)",
      "visibility": "private"
    },
    {
      "source_id": "src-lab-comparison-note-20260828",
      "kind": "research_file",
      "title": "DISH222 vs LAB survey comparison note (28 Aug 2026)",
      "visibility": "private"
    },
    {
      "source_id": "src-session-archive-20260826",
      "kind": "research_file",
      "title": "26 Aug 2026 outer-Galaxy session archive (native spectra, raster manifest, stitched figures)",
      "visibility": "private"
    },
    {
      "source_id": "src-fits-products-20260826",
      "kind": "research_file",
      "title": "26 Aug 2026 FITS products (cube, peak map, velocity map, catalog)",
      "visibility": "private"
    },
    {
      "source_id": "src-fullband-table-20260826",
      "kind": "research_file",
      "title": "26 Aug 2026 un-baselined averaged spectra on a common grid (table)",
      "visibility": "private"
    },
    {
      "source_id": "src-reduced-spectra-table-20260826",
      "kind": "research_file",
      "title": "26 Aug 2026 reduced spectra, dB above fitted baseline (table)",
      "visibility": "private"
    },
    {
      "source_id": "src-workbook-20260826",
      "kind": "research_file",
      "title": "26 Aug 2026 workbook: measurements, spectra and session definitions",
      "visibility": "private"
    },
    {
      "source_id": "src-velocity-table-20260826",
      "kind": "research_file",
      "title": "26 Aug 2026 strong-line LSR velocity table",
      "visibility": "private"
    },
    {
      "source_id": "src-gc-products-20260902",
      "kind": "research_file",
      "title": "2 Sep 2026 galactic-centre area-scan products (FITS and figures)",
      "visibility": "private"
    },
    {
      "source_id": "src-ac-products-20260903",
      "kind": "research_file",
      "title": "3 Sep 2026 anticentre-side scan products (FITS and figure)",
      "visibility": "private"
    },
    {
      "source_id": "src-allsky-products",
      "kind": "research_file",
      "title": "All-sky TRUSTED composite products (FITS and LAB overlay figure)",
      "visibility": "private"
    },
    {
      "source_id": "src-legacy-dish1-v69",
      "kind": "legacy_software",
      "title": "Legacy acquisition/control application, DISH1 V69 (operational snapshot)",
      "visibility": "private",
      "note": "Private legacy software snapshot; locators refer to line numbers in that snapshot."
    },
    {
      "source_id": "src-legacy-dish222-v75",
      "kind": "legacy_software",
      "title": "Legacy acquisition/control application, DISH222 V75 one-app (operational snapshot)",
      "visibility": "private",
      "note": "Private legacy software snapshot; locators refer to line numbers in that snapshot."
    },
    {
      "source_id": "src-phase0-audit",
      "kind": "project_record",
      "title": "Phase 0 audit report (analysis and measurements made during the audit)",
      "visibility": "private",
      "note": "Audit analysis of the supplied archive. Measurements made by the audit are flagged 'inferred'; statements about what the archive does or does not contain are documented."
    },
    {"source_id": "src-project-decisions", "kind": "project_record", "title": "Project decisions log (D1-D5)", "visibility": "private"},
    {
      "source_id": "src-private-project-records",
      "kind": "project_record",
      "title": "Private project records (restricted)",
      "visibility": "private",
      "evidence_limit": "inferred_only",
      "note": "May only support neutral inferred notes. AI-generated analyses contained in these records are not treated as evidence."
    },
    {
      "source_id": "src-site-index",
      "kind": "public_site_page",
      "title": "Radio Astronomy hub page",
      "visibility": "public",
      "path": "radio-astronomy/index.html"
    },
    {
      "source_id": "src-site-project",
      "kind": "public_site_page",
      "title": "Project Story page",
      "visibility": "public",
      "path": "radio-astronomy/project.html"
    },
    {
      "source_id": "src-site-lecture",
      "kind": "public_site_page",
      "title": "Interactive lecture (52 slides)",
      "visibility": "public",
      "path": "radio-astronomy/lecture.html"
    },
    {
      "source_id": "src-ieee-2025",
      "kind": "external_publication",
      "title": "An Educational Radio Telescope Optimized for Hydrogen Line Astronomy (IEEE Antennas and Propagation Magazine 67(6):72-95, Dec 2025)",
      "visibility": "public",
      "doi": "10.1109/MAP.2025.3621127"
    }
  ],
  "datasets": [
    {
      "dataset_id": "ds-20260826-og-native-spectra",
      "title": "26 Aug 2026 outer-Galaxy raster: native averaged spectra (776 NPZ)",
      "campaign": "2026-08-26-outer-galaxy",
      "instrument_id": "dish222",
      "observation_time": {
        "start": "2026-08-26T02:48:00Z",
        "end": "2026-08-26T05:48:00Z",
        "evidence": "documented",
        "sources": [{"source_id": "src-session-archive-20260826", "locator": "NPZ __meta__ saved_utc_iso (first and last chunk)"}],
        "note": "Chunk timestamps are the save time at the END of each averaging window. The folder name '0547' is local time (UTC+3)."
      },
      "target": {
        "value": "Outer Galaxy / outer spiral arm",
        "evidence": "documented",
        "sources": [{"source_id": "src-workbook-20260826", "locator": "Session info: 'morning, outer arm'"}]
      },
      "coverage": {
        "frame": "galactic",
        "lon_min_deg": 146,
        "lon_max_deg": 226,
        "lat_min_deg": -10,
        "lat_max_deg": 20,
        "evidence": "documented",
        "sources": [{"source_id": "src-session-archive-20260826", "locator": "raster manifest track"}]
      },
      "observing_mode": {
        "value": "raster_scan",
        "evidence": "documented",
        "sources": [{"source_id": "src-session-archive-20260826", "locator": "manifest 'mode': 'raster'"}]
      },
      "coordinate_system": {
        "value": "not_applicable",
        "evidence": "documented",
        "sources": [{"source_id": "src-session-archive-20260826", "locator": "NPZ keys"}],
        "note": "NPZ files carry no pointing; positions come from the manifest by time association."
      },
      "velocity_frame": {
        "value": "topocentric",
        "evidence": "documented",
        "sources": [{"source_id": "src-session-archive-20260826", "locator": "NPZ freqAxis (sky frequency)"}],
        "note": "Frequency axis only; no velocity correction applied."
      },
      "velocity_definition": {"value": "not_applicable", "evidence": "documented", "sources": [{"source_id": "src-session-archive-20260826"}]},
      "spectral_line": {
        "name": "H I 21 cm",
        "rest_frequency_mhz": {
          "value": 1420.40575,
          "unit": "MHz",
          "evidence": "documented",
          "sources": [{"source_id": "src-fits-products-20260826", "locator": "RESTFRQ = 1420405750.0 Hz"}]
        }
      },
      "product_class": "native_spectra",
      "data_level": "L0",
      "file_formats": ["zip", "npz"],
      "native_availability": "available",
      "missing_source": false,
      "calibration_id": null,
      "calibration_assignment": {
        "value": "Uncalibrated power (arbitrary units); calibration-independent",
        "evidence": "documented",
        "sources": [{"source_id": "src-session-archive-20260826", "locator": "NPZ avg_lin/avg_dB"}]
      },
      "processing_status": {
        "value": "Welch-averaged power spectra only; schema A additionally divided by a stored background",
        "evidence": "documented",
        "sources": [
          {"source_id": "src-session-archive-20260826", "locator": "NPZ keys and __meta__.bg_present"},